1984.jpeg,/content/drive/MyDrive/ColabNotebooks/Images/1984.jpeg,1984
Apocalypsegirl.jpeg,"/content/drive/MyDrive/ColabNotebooks/Images/ Apocalypsegirl.jpeg","That day you fainted, your eyes looked right through me, from nowhere in particular, dislocated, light, monotonous"
Apocalypsegirl.jpeg,"/content/drive/MyDrive/ColabNotebooks/Images/ Apocalypsegirl.jpeg","Statistics and newspapers tell me I am unhappy and dying, that I need man and child to fulfill me, that I'm more likely to get breast cancer."
Apocalypsegirl.jpeg,"/content/drive/MyDrive/ColabNotebooks/Images/ ApologiestotheQueenMary.jpeg","The bananas rot slowly in my lap, silently, wildly, girly. The rash is an opportunity, a common disease, something in common, a community, the definition must be: something attacking itself"
ApologiestotheQueenMary.jpeg,"/content/drive/MyDrive/ColabNotebooks/Images/ ApologiestotheQueenMary.jpeg",Apologies to the Queen Mary
ApologiestotheQueenMary.jpeg,"/content/drive/MyDrive/ColabNotebooks/Images/ ApologiestotheQueenMary.jpeg","And from my bed, the sound of haunting, hissing in the vent Modern world don't ask why Cause modern world will build things high Lonely hearts, canyons filled with life"
ApologiestotheQueenMary.jpeg,"/content/drive/MyDrive/ColabNotebooks/Images/ ApologiestotheQueenMary.jpeg",But the darling is dead We hit it on the head It looked like a wedding cake But the darling is dead We hit it on the head It looked like a newlywed
ApologiestotheQueenMary.jpeg,"/content/drive/MyDrive/ColabNotebooks/Images/ ApologiestotheQueenMary.jpeg","It was strange, constant blue And the same ghost every night I go walking just to find My own breath, my own breath through the path"
ApologiestotheQueenMary.jpeg,"/content/drive/MyDrive/ColabNotebooks/Images/ ApologiestotheQueenMary.jpeg",You know our hearts beat time out very slowly You know our hearts beat time They're waiting for something that'll never arrive
ApologiestotheQueenMary.jpeg,"/content/drive/MyDrive/ColabNotebooks/Images/ ApologiestotheQueenMary.jpeg","People I can trick them into thinking anything Oh-ho, and rust, it's just right in the light, it's gold, it's golden Oh-ho, I got water and holes in my hands I'm a digger of holes in the land, of holes in"
ApologiestotheQueenMary.jpeg,"/content/drive/MyDrive/ColabNotebooks/Images/ AquaticFlowers.jpeg",From the top of the mountain to the rock and sand They dragged the dead body west til they ran out of land We walked five whole minutes to the dark edge of town Took a long look at nothing and turned back around
AquaticFlowers.jpeg,"/content/drive/MyDrive/ColabNotebooks/Images/ AquaticFlowers.jpeg",Aquatic Flowers
AquaticFlowers.jpeg,"/content/drive/MyDrive/ColabNotebooks/Images/ AquaticFlowers.jpeg",I've got a complex It's complex I don't know why I act this way The things I do the things I say I really love you I wanna be with you But I'm so scared
AquaticFlowers.jpeg,"/content/drive/MyDrive/ColabNotebooks/Images/ AquaticFlowers.jpeg","I need your love and I want it to find me So IÕll have to hang back patiently Waitin, waitin for the stars to agree I need your love; why canÕt it be me?"
AquaticFlowers.jpeg,"/content/drive/MyDrive/ColabNotebooks/Images/ AquaticFlowers.jpeg",The voice in my head speaks louder than Anything you could say So deep are the grooves IÕm sinking into No love could ever wash away There must be something wrong with you for loving someone like me
AquaticFlowers.jpeg,"/content/drive/MyDrive/ColabNotebooks/Images/ AquaticFlowers.jpeg","Sallowed, useless Nothing is at stake So you cultivate your taste Imagine a struggle Copy your scene Mannequin In faux greenery"
AquaticFlowers.jpeg,"/content/drive/MyDrive/ColabNotebooks/Images/ AquaticFlowers.jpeg",Feeling all the sorrow of a broken world Heavy garlands hang from a divine fighter When you break the silence Does it feel like
AquaticFlowers.jpeg,"/content/drive/MyDrive/ColabNotebooks/Images/ AreWeThere.jpeg",You canÕt change the world But you can change yourself ThatÕs all you gotta do ItÕs the stories of our love that need tending to Open up your mind Before youÕre swallowed by time
AreWeThere.jpeg,"/content/drive/MyDrive/ColabNotebooks/Images/ AreWeThere.jpeg",Are We There
AreWeThere.jpeg,"/content/drive/MyDrive/ColabNotebooks/Images/ AreWeThere.jpeg","I can't wait till we're afraid of nothing I can't wait till we hide from nothing Nothing, and you decide You throw me a lame wait shit out You're a little late I need you to be afraid of nothing"
AreWeThere.jpeg,"/content/drive/MyDrive/ColabNotebooks/Images/ AreWeThere.jpeg",Break my legs so I won't walk to you Cut my tongue so I can't talk to you Burn my skin so I can't feel you Stab my eyes so I can't see You like it when I let you walk over me You tell me that you like it Your love is killing me
AreWeThere.jpeg,"/content/drive/MyDrive/ColabNotebooks/Images/ AreWeThere.jpeg","Promises that we forgot I suppose that we were lost It's turning into something we can change I love you, but I'm lost Between the pain and cost I hold myself a lot I love you, but I'm lost"
AreWeThere.jpeg,"/content/drive/MyDrive/ColabNotebooks/Images/ AreWeThere.jpeg",All the skies are fallin' and the sun is movin' up and down Even when you're in a dark way Some decisions shield you from the positivity until You reach out to me
AreWeThere.jpeg,"/content/drive/MyDrive/ColabNotebooks/Images/ AreWeThere.jpeg",He can break me With one hand to my head He can make me move into a city Taking me as I am As he lets me in
AreWeThere.jpeg,"/content/drive/MyDrive/ColabNotebooks/Images/ AreYouExperienced.jpeg","You see me turn around and try to hide my sigh I know the ancient melodies will come at night I sing about my fear and love and what it brings I know, I know"
AreYouExperienced.jpeg,"/content/drive/MyDrive/ColabNotebooks/Images/ AreYouExperienced.jpeg",Are You Experienced
AreYouExperienced.jpeg,"/content/drive/MyDrive/ColabNotebooks/Images/ AreYouExperienced.jpeg","Woman so willing, the sweet cause in vain You make love, you break love It's all the same When it's, when it's over, mama Music, sweet music I wish I could caress, caress, caress Manic depression is a frustrating mess"
AreYouExperienced.jpeg,"/content/drive/MyDrive/ColabNotebooks/Images/ AreYouExperienced.jpeg","Purple haze all around Don't know if I'm coming up or down Am I happy or in misery? Whatever it is, that girl put a spell on me"
AreYouExperienced.jpeg,"/content/drive/MyDrive/ColabNotebooks/Images/ AreYouExperienced.jpeg","You don't care for me I don't care about that You got a new fool, ha! I like it like that I have only one burning desire Let me stand next to your fire"
AreYouExperienced.jpeg,"/content/drive/MyDrive/ColabNotebooks/Images/ AreYouExperienced.jpeg","I want to take you home, yeah I won't do you no harm, no You've got to be all mine, all mine Ooh, foxy lady"
AreYouExperienced.jpeg,"/content/drive/MyDrive/ColabNotebooks/Images/ AreYouExperienced.jpeg",Strange beautiful grass of green With your majestic silver seas Your mysterious mountains I'd wish to see closer May I land my kinky machine?
AreYouExperienced.jpeg,"/content/drive/MyDrive/ColabNotebooks/Images/ Aromanticism.jpeg","I'm going down to shoot my old lady You know, I caught her messing around with another man And that ain't too cool"
Aromanticism.jpeg,"/content/drive/MyDrive/ColabNotebooks/Images/ Aromanticism.jpeg",Aromanticism
Aromanticism.jpeg,"/content/drive/MyDrive/ColabNotebooks/Images/ Aromanticism.jpeg","IÕm not a body, the body is but a shell I disembody but suffering is sovereign Still no grasp of reality The world is a wonderland scene"
Aromanticism.jpeg,"/content/drive/MyDrive/ColabNotebooks/Images/ Aromanticism.jpeg","If I don't have tools to fight, calling this a quarrel isn't right Quoting this a quarrel so immorally implies We're equal opponents and we both antagonize Don't call it a Lovers' Quarrel"
Aromanticism.jpeg,"/content/drive/MyDrive/ColabNotebooks/Images/ Aromanticism.jpeg","Lonely, lonely, lonely face under a veil After all the laughter, emptiness prevails Born into this world with no consent or choice Lonely, lonely, lonely, lonely, lonely, lonely"
Aromanticism.jpeg,"/content/drive/MyDrive/ColabNotebooks/Images/ Aromanticism.jpeg",I just wanna make out in my car IÕm not tryna go to bed with you I just wanna make out in my car IÕm not tryna go to bed with you
Aromanticism.jpeg,"/content/drive/MyDrive/ColabNotebooks/Images/ Aromanticism.jpeg",All my old lovers have found others I was lost in the rapture Dead Sea as barren as a stutter And colored laughter I don't trouble nobody Nobody troubles my body after All my old others have found lovers
Aromanticism.jpeg,"/content/drive/MyDrive/ColabNotebooks/Images/ ArtAngels.jpeg","Shootin' cross the sky like a star But nobody told me To never let it get too far You see my silhouette, so you're standing scared of me Can I tell you a secret?"
ArtAngels.jpeg,"/content/drive/MyDrive/ColabNotebooks/Images/ ArtAngels.jpeg",Art Angels
ArtAngels.jpeg,"/content/drive/MyDrive/ColabNotebooks/Images/ ArtAngels.jpeg","The things they see in me, I cannot see myself When you get bored of me, I'll be back on the shelf And when the ocean rises up above the ground Maybe I'll drown in California"
ArtAngels.jpeg,"/content/drive/MyDrive/ColabNotebooks/Images/ ArtAngels.jpeg","Baby, believe me And you had every chance You destroy everything that you know Uncontrollable If you don't need me Just let me go"
ArtAngels.jpeg,"/content/drive/MyDrive/ColabNotebooks/Images/ ArtAngels.jpeg","I, I've been thinking, I've been thinking I, I could leave the world today Everybody dies, we anoint their eyes and we dance like angels do Writing out your name, little shapes that feign some knowledge of you"
ArtAngels.jpeg,"/content/drive/MyDrive/ColabNotebooks/Images/ ArtAngels.jpeg","I got in a fight, I was indisposed I was in, despite all the wicked prose But I'm only a man, and I do what I can I got friends in high places I get out for free I got in a fight but they don't know me"
ArtAngels.jpeg,"/content/drive/MyDrive/ColabNotebooks/Images/ ArtAngels.jpeg","I donÕt need no medicine Gonna dance all night IÕm high on adrenaline That's right, that's right, that's right"
ArtAngels.jpeg,"/content/drive/MyDrive/ColabNotebooks/Images/ ARTPOP.jpeg","Oh, baby, every morning there are mountains to climb Taking all my time Oh, when I get up, this is what I see Welcome to reality"
ARTPOP.jpeg,"/content/drive/MyDrive/ColabNotebooks/Images/ ARTPOP.jpeg",ARTPOP
ARTPOP.jpeg,"/content/drive/MyDrive/ColabNotebooks/Images/ ARTPOP.jpeg","Do you wanna touch me, cosmic lover? Do you wanna peek underneath the cover? Do you wanna see the girl who lives behind the aura? Behind the aura, behind the aura, behind the aura?"
ARTPOP.jpeg,"/content/drive/MyDrive/ColabNotebooks/Images/ ARTPOP.jpeg","When you touch me, I die just a little inside I wonder if this could be love, this could be love Cause you're out of this world, galaxy, space, and time I wonder if this could be love, this could be love"
ARTPOP.jpeg,"/content/drive/MyDrive/ColabNotebooks/Images/ ARTPOP.jpeg","Don't stop the party Making love in my sex dreams Let's keep it naughty, yeah Making love in my sex dreams Watch me act a fool Making love in my sex dreams Tomorrow when I run into you, tomorrow when I run into you"
ARTPOP.jpeg,"/content/drive/MyDrive/ColabNotebooks/Images/ ARTPOP.jpeg",Put some lipstick on Perfume your neck and slip your high heels on Rinse and curl your hair Loosen your hips and get a dress to wear
ARTPOP.jpeg,"/content/drive/MyDrive/ColabNotebooks/Images/ ARTPOP.jpeg",A hybrid can withstand these things My heart can beat with bricks and strings My ARTPOP could mean anything Could try to sell you out or I Could show you all the reasons why My ARTPOP could mean anything
ARTPOP.jpeg,"/content/drive/MyDrive/ColabNotebooks/Images/ Arular.jpeg","My heart would break without you Might not awake without you Been hurting low from living high for so long I'm sorry, and I love you Sing with me, Bell Bottom Blue I'll keep on searching for an answer, 'cause I need you more than dope"
Arular.jpeg,"/content/drive/MyDrive/ColabNotebooks/Images/ Arular.jpeg",Arular
Arular.jpeg,"/content/drive/MyDrive/ColabNotebooks/Images/ Arular.jpeg","You no like the people, they no like you Then they gonna set it off with a big boom Son in a battle, is a son and battle too Why you wanna talk about who done who?"
Arular.jpeg,"/content/drive/MyDrive/ColabNotebooks/Images/ Arular.jpeg","Can't stereotype my thing, yo I salt and pepper my mango Shoot, spit out the window Bingo, I got him in the thing, yo Now what? I'm doing my thing, yo"
Arular.jpeg,"/content/drive/MyDrive/ColabNotebooks/Images/ Arular.jpeg","Growin' up, brewin' up Guerrilla gettin' trained up Look out, look out From over the rooftop Competition coming up now Load up, aim, fire, fire, pop"
Arular.jpeg,"/content/drive/MyDrive/ColabNotebooks/Images/ Arular.jpeg",Me come from New Delhi Me not got no worry And if you fuck with me I'm gon' dash my curry
Arular.jpeg,"/content/drive/MyDrive/ColabNotebooks/Images/ Arular.jpeg","Somewhere in the Amazon, they're holding me ransom Painted nails, sunsets on horizons Palm trees, silhouette smells amazing Blindfolds under homemade lanterns Somewhere in the Amazon, they're holding me ransom"
Arular.jpeg,"/content/drive/MyDrive/ColabNotebooks/Images/ ARushofBloodtotheHead.jpeg","U-R-A-Q-T Is your dad a dealer? 'Cause you're dope to me You throw them balls across the country You win gold medals for when you're with me You big dummy! Right then, it's on, right then, it's on"
ARushofBloodtotheHead.jpeg,"/content/drive/MyDrive/ColabNotebooks/Images/ ARushofBloodtotheHead.jpeg",A Rush of Blood to the Head
ARushofBloodtotheHead.jpeg,"/content/drive/MyDrive/ColabNotebooks/Images/ ARushofBloodtotheHead.jpeg",Where do we go? Nobody knows I've got to say I'm on my way down God give me style and give me grace God put a smile upon my face
ARushofBloodtotheHead.jpeg,"/content/drive/MyDrive/ColabNotebooks/Images/ ARushofBloodtotheHead.jpeg","Nobody said it was easy It's such a shame for us to part Nobody said it was easy No one ever said it would be this hard Oh, take me back to the start"
ARushofBloodtotheHead.jpeg,"/content/drive/MyDrive/ColabNotebooks/Images/ ARushofBloodtotheHead.jpeg",Confusion never stops Closing walls and tickin' clocks Gonna come back and take you home I could not stop that you now know
ARushofBloodtotheHead.jpeg,"/content/drive/MyDrive/ColabNotebooks/Images/ ARushofBloodtotheHead.jpeg","Ooh, and the sun shine Yeah, on this heart of mine Oooh, and I realise Who couldn't live without Ooh, come apart without it"
ARushofBloodtotheHead.jpeg,"/content/drive/MyDrive/ColabNotebooks/Images/ ARushofBloodtotheHead.jpeg","Honey, all the movements you're starting to make See me crumble and fall on my face And I know the mistakes that I made See it all disappear without trace And they call as they beckon you on They say start as you mean to go on Start as you mean to go on"
ARushofBloodtotheHead.jpeg,"/content/drive/MyDrive/ColabNotebooks/Images/ ASeatAtTheTable.jpeg","Because I came here with a load And it feels so much lighter since I met you And, honey, you should know That I could never go on without you"
ASeatAtTheTable.jpeg,"/content/drive/MyDrive/ColabNotebooks/Images/ ASeatAtTheTable.jpeg",A Seat At The Table
ASeatAtTheTable.jpeg,"/content/drive/MyDrive/ColabNotebooks/Images/ ASeatAtTheTable.jpeg","Fall in your ways, so you can crumble Fall in your ways, so you can sleep at night Fall in your ways, so you can wake up and rise"
ASeatAtTheTable.jpeg,"/content/drive/MyDrive/ColabNotebooks/Images/ ASeatAtTheTable.jpeg","Well it's like cranes in the sky Sometimes I don't wanna feel those metal clouds Yeah, it's like cranes in the sky Sometimes I don't wanna feel those metal clouds"
ASeatAtTheTable.jpeg,"/content/drive/MyDrive/ColabNotebooks/Images/ ASeatAtTheTable.jpeg","You made my bed, dealt with it when the lights went out Now looking back for temporary nothings But I bet on it, you'll all be here when the lights come out Still looking for nothing"
ASeatAtTheTable.jpeg,"/content/drive/MyDrive/ColabNotebooks/Images/ ASeatAtTheTable.jpeg","Don't touch my hair When it's the feelings I wear
Don't touch my soul When it's the rhythm I know Don't touch my crown They say the vision I've found Don't touch what's there When it's the feelings I wear"
ASeatAtTheTable.jpeg,"/content/drive/MyDrive/ColabNotebooks/Images/ ASeatAtTheTable.jpeg",You know I have the world to think And I know I gotta go ahead and take some time Because the last thing that I want Is thinking that it's time that I leave the borderline
ASeatAtTheTable.jpeg,"/content/drive/MyDrive/ColabNotebooks/Images/ AskRufus.jpeg","Put the incense on Cover up the smell And if your boys go down, I know you'll never tell You're a superstar You're a superstar Always shining in the night And your skin glowing in the moonlight"
AskRufus.jpeg,"/content/drive/MyDrive/ColabNotebooks/Images/ AskRufus.jpeg",Ask Rufus
AskRufus.jpeg,"/content/drive/MyDrive/ColabNotebooks/Images/ AskRufus.jpeg","Since there was you I changed my mind about it all Instead of going on I'm gonna settle for a fall My love, my love will lift you up, up, up"
AskRufus.jpeg,"/content/drive/MyDrive/ColabNotebooks/Images/ AskRufus.jpeg",Cause I know you've always been in the place Please forgive me if I turn away I'm just a sleeper I know that you watch my dreams You're my heavenly keeper
AskRufus.jpeg,"/content/drive/MyDrive/ColabNotebooks/Images/ AskRufus.jpeg",I wanna give you an everlasting love I wanna fill your life with a satisfying love All you need is an everlasting love All you want is a mystifying love
AskRufus.jpeg,"/content/drive/MyDrive/ColabNotebooks/Images/ AskRufus.jpeg","You know he's gonna be dressed to kill He's gonna find some brand new thrills Whatever he's been looking for, tell him that there's so much more In Hollywood Hollywood"
AskRufus.jpeg,"/content/drive/MyDrive/ColabNotebooks/Images/ AskRufus.jpeg","Oh, if he would just remain I'd show him how I could love him
Or I get the feeling that he knows me From some other time before Wonder how he could forget me Can't explain why I'm comin' back for more"
AskRufus.jpeg,"/content/drive/MyDrive/ColabNotebooks/Images/ asofterfocus.jpeg","I just can't hide it So I decided to give Stored away, I've got the strength to live, yeah, uh-huh There'll be better days We've got better days There'll be better days, yeah, yeah"
asofterfocus.jpeg,"/content/drive/MyDrive/ColabNotebooks/Images/ asofterfocus.jpeg",a softer focus
asofterfocus.jpeg,"/content/drive/MyDrive/ColabNotebooks/Images/ asofterfocus.jpeg",i'm trying not to miss you i put on the newest blackbear song
asofterfocus.jpeg,"/content/drive/MyDrive/ColabNotebooks/Images/ asofterfocus.jpeg","First time i got a hug from you, it felt right I might have said it for you "
asofterfocus.jpeg,"/content/drive/MyDrive/ColabNotebooks/Images/ asofterfocus.jpeg",And all i've got for you is the purest of intentions I lay down Trying to work out a space In my own head
asofterfocus.jpeg,"/content/drive/MyDrive/ColabNotebooks/Images/ asofterfocus.jpeg",I'm trying not to (try to) miss it It's a question
asofterfocus.jpeg,"/content/drive/MyDrive/ColabNotebooks/Images/ asofterfocus.jpeg",Then do they feel it Inside a gaze
asofterfocus.jpeg,"/content/drive/MyDrive/ColabNotebooks/Images/ AsTheLoveContinues.jpeg","I'm trying to make some sort of stoned gesture, to let you know that i appreciated it"
AsTheLoveContinues.jpeg,"/content/drive/MyDrive/ColabNotebooks/Images/ AsTheLoveContinues.jpeg",As The Love Continues
AsTheLoveContinues.jpeg,"/content/drive/MyDrive/ColabNotebooks/Images/ AsTheLoveContinues.jpeg","To the bin my friend, tonight we vacate earth"
AsTheLoveContinues.jpeg,"/content/drive/MyDrive/ColabNotebooks/Images/ AsTheLoveContinues.jpeg","Rise crystal spear, fly true over me Suddenly gone from here, left alone on the road"
AsTheLoveContinues.jpeg,"/content/drive/MyDrive/ColabNotebooks/Images/ AsTheLoveContinues.jpeg","Disappear in the sun All gone, all gone It took a while just to think Of home, of home"
AsTheLoveContinues.jpeg,"/content/drive/MyDrive/ColabNotebooks/Images/ AsTheLoveContinues.jpeg",What brings you back? Promises of a memory Your own ghost running away with the past
AsTheLoveContinues.jpeg,"/content/drive/MyDrive/ColabNotebooks/Images/ AsTheLoveContinues.jpeg",My oldest friend that I barely knew So much fun hanging around in the dark You stop time
AsTheLoveContinues.jpeg,"/content/drive/MyDrive/ColabNotebooks/Images/ AstralWeeks.jpeg",Managed to somehow find a way out of here Dagger in everyone's heart
AstralWeeks.jpeg,"/content/drive/MyDrive/ColabNotebooks/Images/ AstralWeeks.jpeg",Astral Weeks
AstralWeeks.jpeg,"/content/drive/MyDrive/ColabNotebooks/Images/ AstralWeeks.jpeg",If I ventured in the slipstream Between the viaducts of your dream Where immobile steel rims crack And the ditch in the back roads stop
AstralWeeks.jpeg,"/content/drive/MyDrive/ColabNotebooks/Images/ AstralWeeks.jpeg",Way across the country where the hillside mountains glide The dynamo of your smile caressed the barefoot virgin child to wander Past your window with the lantern lit
AstralWeeks.jpeg,"/content/drive/MyDrive/ColabNotebooks/Images/ AstralWeeks.jpeg","And I will never grow so old again And I will walk and talk In gardens all wet with rain Oh, sweet thing, sweet thing"
AstralWeeks.jpeg,"/content/drive/MyDrive/ColabNotebooks/Images/ AstralWeeks.jpeg",I may go crazy Before that mansion on the hill But my heart keeps beating faster And my feet can't keep still
AstralWeeks.jpeg,"/content/drive/MyDrive/ColabNotebooks/Images/ AstralWeeks.jpeg","Then we sat on our own star and dreamed of the way that I was for you And you were for me And then we danced the night away And turned to each other, say, I love you, I love you The way that young lovers do"
AstralWeeks.jpeg,"/content/drive/MyDrive/ColabNotebooks/Images/ ASTROWORLD.jpeg","And if somebody, not just anybody Wanted to get close to you For instance, me, baby All you gotta do is ring a bell Step right up, step right up And step right up, ballerina Crowd will catch you Fly it, sigh it, try it"
ASTROWORLD.jpeg,"/content/drive/MyDrive/ColabNotebooks/Images/ ASTROWORLD.jpeg",ASTROWORLD
ASTROWORLD.jpeg,"/content/drive/MyDrive/ColabNotebooks/Images/ ASTROWORLD.jpeg","Rollin', rollin', rollin', got me stargazin' Sippin' on purp, feelin' like the Barre Baby It's lit Whatever I downed, it got me goin' crazy Yah Psychedelics got me goin' crazy Alright"
ASTROWORLD.jpeg,"/content/drive/MyDrive/ColabNotebooks/Images/ ASTROWORLD.jpeg","She's in love with who I am Back in high school, I used to bus it to the dance Now I hit the FBO with duffels in my hands I did half a Xan, thirteen hours 'til I land Had me out like a light, ayy, yeah Like a light, ayy, yeah"
ASTROWORLD.jpeg,"/content/drive/MyDrive/ColabNotebooks/Images/ ASTROWORLD.jpeg","I don't wanna wake up I don't wanna wake up I want it flowin' through my streams Want it flowin' through my streams Ha, gettin' me hot Gettin' me hot Oh, under my feet I don't wanna wake up "
ASTROWORLD.jpeg,"/content/drive/MyDrive/ColabNotebooks/Images/ ASTROWORLD.jpeg","Who's that creeping through my window? 'Fore you come outside, I got the M4 Took her to the endzone from the Enzo Know I love to smoke, you love to lick more"
ASTROWORLD.jpeg,"/content/drive/MyDrive/ColabNotebooks/Images/ ASTROWORLD.jpeg","Me and my bitch, I swear we like the same sex Fuck with all my chains on, let's have chain sex Hangin' with the gang, you get your fangs wet Wanna kick with the gang? You gotta bang it"
ASTROWORLD.jpeg,"/content/drive/MyDrive/ColabNotebooks/Images/ AtFillmoreEast.jpeg","I might need me some ventilation A little vacation, Houstonfornication
Mind redefine new renovations Space coupe back out of the space station If it rise on the East, land on the West We gon' make that shit pop, bust it for a check Call the plays, link the squad, we gon' make it cash"
AtFillmoreEast.jpeg,"/content/drive/MyDrive/ColabNotebooks/Images/ AtFillmoreEast.jpeg",AtFillmoreEast
AtFillmoreEast.jpeg,"/content/drive/MyDrive/ColabNotebooks/Images/ AtFillmoreEast.jpeg","Well my momma died and left me, my poppa died and left me I ain't good looking baby but I'm somewhat sweet and kind I'm goin' to the country, baby do you wanna go?"
AtFillmoreEast.jpeg,"/content/drive/MyDrive/ColabNotebooks/Images/ AtFillmoreEast.jpeg","I love that woman, better than any woman I've ever seen Well I love that woman better than any woman I've ever seen Now she treat me like a king, yeah, yeah, yeah And she look like a dog gone queen"
AtFillmoreEast.jpeg,"/content/drive/MyDrive/ColabNotebooks/Images/ AtFillmoreEast.jpeg","The bell has tolled, my baby caught that train 'n gone It was all my fault, I musta' did somebody wrong Oh play the blues"
AtFillmoreEast.jpeg,"/content/drive/MyDrive/ColabNotebooks/Images/ AtFillmoreEast.jpeg","Lord, goodbye now, pretty baby If I never see you no more Well if you think I'll be your fool, Lord You better be on your merry way"
AtFillmoreEast.jpeg,"/content/drive/MyDrive/ColabNotebooks/Images/ AtFillmoreEast.jpeg","You don't love me, pretty baby You don't love me, yes I know Well if you leave me, pretty baby Don't you know you're gonna hurt me so"
AtFillmoreEast.jpeg,"/content/drive/MyDrive/ColabNotebooks/Images/ AtFolsomPrison.jpeg",The eagle flies on Friday Saturday I go out to play Sunday I go to church Gonna kneel down and pray
