1984.jpeg,/content/drive/MyDrive/ColabNotebooks/Images/1984.jpeg,1984
Californication.jpeg,"/content/drive/MyDrive/ColabNotebooks/Images/ CallMe.jpeg","A black and white, a red and blue Ah, things that look good on you And if I scream, don't let me go A purple stain, I know And if I call for you to stay Come hit the funk on your way It's way out there but I don't care 'Cause this is where I go"
CallMe.jpeg,"/content/drive/MyDrive/ColabNotebooks/Images/ CallMe.jpeg",Call Me
CallMe.jpeg,"/content/drive/MyDrive/ColabNotebooks/Images/ CallMe.jpeg","Losing your love, acting foolishly Go on and take your time 'Cause you're only losing me Love is a long ways from here Tell you, it's all in the way you feel If your love is real Come to me"
CallMe.jpeg,"/content/drive/MyDrive/ColabNotebooks/Images/ CallMe.jpeg","Hey girl, since you been away with him My life has been cloudy and days been awful dim But you're looking well Baby, would you rather be there with him? Would you reconsider and come running back to me?"
CallMe.jpeg,"/content/drive/MyDrive/ColabNotebooks/Images/ CallMe.jpeg","Our love is you and me, baby That make the world go round And if keeping you and loving you means Laying all my troubles down Here I am, baby, come and take me "
CallMe.jpeg,"/content/drive/MyDrive/ColabNotebooks/Images/ CallMe.jpeg","I'm trying to realize You being with some other guy I don't know the reason why You oughta be with me until I die Hey, you ought to be with me until I die"
CallMe.jpeg,"/content/drive/MyDrive/ColabNotebooks/Images/ CallMe.jpeg","Before my cup runs over All this love's inside of me I believe there's going to be an explosion, yeah You can talk to me, oh baby"
CallMe.jpeg,"/content/drive/MyDrive/ColabNotebooks/Images/ CallMeIfYouGetLost.jpeg","Look at the morning sun, shining so brightly Love is in the air, I don't care Look at the smiling faces Makes me know that no one can take your place"
CallMeIfYouGetLost.jpeg,"/content/drive/MyDrive/ColabNotebooks/Images/ CallMeIfYouGetLost.jpeg",Call Me If You Get Lost
CallMeIfYouGetLost.jpeg,"/content/drive/MyDrive/ColabNotebooks/Images/ CallMeIfYouGetLost.jpeg","I'ma travel the globe, you keep the block hot Driver, open the door for me, my hand hurt Find us, we playin' hide-and-seek with the passports Where the fuck we at? Oh, the pilot gotta remind us, yeah"
CallMeIfYouGetLost.jpeg,"/content/drive/MyDrive/ColabNotebooks/Images/ CallMeIfYouGetLost.jpeg","Massa couldn't catch me, my legs long than a bitch Got too much self-respect, I wash my hands 'fore I piss They try to talk meÑ, ehm, I'ma just go"
CallMeIfYouGetLost.jpeg,"/content/drive/MyDrive/ColabNotebooks/Images/ CallMeIfYouGetLost.jpeg","Ain't nothin' to you, but we somethin' to them, them When you in your room and you starin' at the ceilin' Dreamin', I want you to know it's no ceilings I want you to notice that feelin' I want you to leap and go for it"
CallMeIfYouGetLost.jpeg,"/content/drive/MyDrive/ColabNotebooks/Images/ CallMeIfYouGetLost.jpeg","Crackin' like broke porcelain, bitch We ocean deep if you just pour us in a portion of shit Them people try to twist my view on some contortionist shit"
CallMeIfYouGetLost.jpeg,"/content/drive/MyDrive/ColabNotebooks/Images/ CallMeIfYouGetLost.jpeg","What makes you think I'm not in love? How could you know What's best for us? Why am I here Standing alone? 'Cause I thought, I thought you wanted to dance, yeah Welcome to the disco"
CallMeIfYouGetLost.jpeg,"/content/drive/MyDrive/ColabNotebooks/Images/ CandyO.jpeg","Ride to the dinner tapin' Outta time and imagine her in the exit Last deal more than what Google say my net is I got cheddar with the chef in the tinted exit Like woah Yeah, uh, uh, uh, woah"
CandyO.jpeg,"/content/drive/MyDrive/ColabNotebooks/Images/ CandyO.jpeg",Candy-O
CandyO.jpeg,"/content/drive/MyDrive/ColabNotebooks/Images/ CandyO.jpeg",She's a frozen fire She's my one desire And I don't want to hold her down Don't want to break her crown When she says Let's go I like the nightlife baby
CandyO.jpeg,"/content/drive/MyDrive/ColabNotebooks/Images/ CandyO.jpeg",I fell over you Once in a shadow I finally grew And once in a night I dreamed you were there I canceled my flight From going nowhere It's all I can do To keep waiting for you
CandyO.jpeg,"/content/drive/MyDrive/ColabNotebooks/Images/ CandyO.jpeg","Well, lift me from the wondermaze Alienation is the craze And it's all gonna happen to you You think it's a phase And it's all gonna happen to you When you drive in the haze"
CandyO.jpeg,"/content/drive/MyDrive/ColabNotebooks/Images/ CandyO.jpeg","Purple home, assorted cars Razor lights you'll bring And all to prove you're on the move And vanishing Candy-O, I need you so Candy-O, I need you so"
CandyO.jpeg,"/content/drive/MyDrive/ColabNotebooks/Images/ CandyO.jpeg","Ooh, how you shake me up and down When we hit the nightspots on the town Oh It's all behind you when you do catch on You keep your lovers in a penny jar A real romantic with a sultry stare You keep on messin' with your blonde, long hair yeah"
CandyO.jpeg,"/content/drive/MyDrive/ColabNotebooks/Images/ CantBuyaThrill.jpeg",They're crazy about each other Like a misplaced fix They're mad about each other They blame it all on the lust for kicks He's just a hit parader She's just a cycle ride He likes to masquerade her And she tells him lies
CantBuyaThrill.jpeg,"/content/drive/MyDrive/ColabNotebooks/Images/ CantBuyaThrill.jpeg",Cant Buy a Thrill
CantBuyaThrill.jpeg,"/content/drive/MyDrive/ColabNotebooks/Images/ CantBuyaThrill.jpeg",And you fire till he is done in But they catch you at the border And the mourners are all sangin' As they drag you by your feet But the hangman isn't hangin' And they put you on the street
CantBuyaThrill.jpeg,"/content/drive/MyDrive/ColabNotebooks/Images/ CantBuyaThrill.jpeg","Like the castle in its corner In a medieval game I foresee terrible trouble And I stay here just the same I'm a fool to do your dirty work, oh yeah I don't wanna do your dirty work no more"
CantBuyaThrill.jpeg,"/content/drive/MyDrive/ColabNotebooks/Images/ CantBuyaThrill.jpeg",Tell me where are you driving Midnight cruiser? Where is your bounty of fortune and fame? I am another gentleman loser Drive me to Harlem or somewhere the same
CantBuyaThrill.jpeg,"/content/drive/MyDrive/ColabNotebooks/Images/ CantBuyaThrill.jpeg","You know there's fire in the hole And nothing left to burn I'd love to run out now There's nowhere left to turn, no no"
CantBuyaThrill.jpeg,"/content/drive/MyDrive/ColabNotebooks/Images/ CantBuyaThrill.jpeg",If you wanna get thru' the years It's high time you played your card If you live in this world You're feelin' the change of the guard Na na na na na na na na
CantBuyaThrill.jpeg,"/content/drive/MyDrive/ColabNotebooks/Images/ Capacity.jpeg",His lady's aching to bring a body down She daily preaches on where she wants to be An evening with a movie queen A face we all have seen Brooklyn owes the charmer under me
Capacity.jpeg,"/content/drive/MyDrive/ColabNotebooks/Images/ Capacity.jpeg",Capacity
Capacity.jpeg,"/content/drive/MyDrive/ColabNotebooks/Images/ Capacity.jpeg","Don't take me for a fool There's a woman inside of me There's one inside of you, too And she don't always do pretty things"
Capacity.jpeg,"/content/drive/MyDrive/ColabNotebooks/Images/ Capacity.jpeg",Flight is a beautiful word Flowered with consonance ThatÕs what I'll followed Forever I am a beautiful bird Fluttered and floating Swollen and hollowed For heaven
Capacity.jpeg,"/content/drive/MyDrive/ColabNotebooks/Images/ Capacity.jpeg",He cut off my oxygen And my eyes were watering As he tore into my skin like a lion I knew it was poison As he filled me to the brim And my blood was dripping like a lamb
Capacity.jpeg,"/content/drive/MyDrive/ColabNotebooks/Images/ Capacity.jpeg","Mercury, creeping on the sea How she wails, flails her arms and weeps Accumulation of debris Lips apart, flapping as a lark For in the dark there is release Every familiarity scarce as the great white shark"
Capacity.jpeg,"/content/drive/MyDrive/ColabNotebooks/Images/ Capacity.jpeg",No ordinary measurement You turn your own light on You turn your own light on inside of me Closer the farther you've gone Stronger the harder you fall in front of me Walking through your garden Pulling up the garlic Getting our hands dirty
Capacity.jpeg,"/content/drive/MyDrive/ColabNotebooks/Images/ CarrieLowell.jpeg","Oh, when it gets you down When you get that notion Any way you walk around Anywhere that you are going If you ever wanna come back"
CarrieLowell.jpeg,"/content/drive/MyDrive/ColabNotebooks/Images/ CarrieLowell.jpeg",Carrie Lowell
CarrieLowell.jpeg,"/content/drive/MyDrive/ColabNotebooks/Images/ CarrieLowell.jpeg","Somewhere in the desert, thereÕs a forest And an acre before us But I donÕt know where to begin But I donÕt know where to begin Again, I've lost my strength completely, oh be near me Tired, old mare with the wind in your hair"
CarrieLowell.jpeg,"/content/drive/MyDrive/ColabNotebooks/Images/ CarrieLowell.jpeg","Captain of my feelings The only thing I wanna believe When I was three, and free to explore I saw her face on the back of the door Oh, be my rest, be my fantasy"
CarrieLowell.jpeg,"/content/drive/MyDrive/ColabNotebooks/Images/ CarrieLowell.jpeg",The strength of his arm My lover caught me off guard How? Head of a rabbit How? Head of a rabbit For my prayer has always been love What did I do to deserve this?
CarrieLowell.jpeg,"/content/drive/MyDrive/ColabNotebooks/Images/ CarrieLowell.jpeg","Well, you do enough talk My little hawk, why do you cry? Tell me, what did you learn from the Tillamook burn? Or the Fourth of July? WeÕre all gonna die"
CarrieLowell.jpeg,"/content/drive/MyDrive/ColabNotebooks/Images/ CarrieLowell.jpeg","So can we pretend, sweetly Before the mystery ends? I am a man with a heart that offends With its lonely and greedy demands ThereÕs only a shadow of me; in a matter of speaking, I'm dead"
CarrieLowell.jpeg,"/content/drive/MyDrive/ColabNotebooks/Images/ CarWheelsonaGravelRoad.jpeg","My blue bucket of gold Friend, why donÕt you love me? Once the myth has been told The lens deforms it as lightning Raise your right hand"
CarWheelsonaGravelRoad.jpeg,"/content/drive/MyDrive/ColabNotebooks/Images/ CarWheelsonaGravelRoad.jpeg",Car Wheels on a Gravel Road
CarWheelsonaGravelRoad.jpeg,"/content/drive/MyDrive/ColabNotebooks/Images/ CarWheelsonaGravelRoad.jpeg","Not a day goes by I don't think about you You left your mark on me, it's permanent, a tattoo Pierce the skin and the blood runs through Oh my baby"
CarWheelsonaGravelRoad.jpeg,"/content/drive/MyDrive/ColabNotebooks/Images/ CarWheelsonaGravelRoad.jpeg","House rules, no exceptions No bad language, no gambling, no fighting Sorry, no credit, don't ask Bathroom wall reads: Is God the answer? Yes Too cool to be forgotten Hey, hey, too cool to be forgotten June bug versus hurricane"
CarWheelsonaGravelRoad.jpeg,"/content/drive/MyDrive/ColabNotebooks/Images/ CarWheelsonaGravelRoad.jpeg",Followers would cling to you Hang around just to meet you Some threw roses at your feet And watch you pass out on the street Drunken angel
CarWheelsonaGravelRoad.jpeg,"/content/drive/MyDrive/ColabNotebooks/Images/ CarWheelsonaGravelRoad.jpeg",This wall divides us We're on two different sides But this wall is not real How can it be real It's only made of concrete and barbed wire
CarWheelsonaGravelRoad.jpeg,"/content/drive/MyDrive/ColabNotebooks/Images/ CarWheelsonaGravelRoad.jpeg","He won't take me back when I come around Says he's sorry then he pulls me out I got a big chain around my neck And I'm broken down like a train wreck Well, it's over, I know it but I can't let go"
CarWheelsonaGravelRoad.jpeg,"/content/drive/MyDrive/ColabNotebooks/Images/ CASESTUDY01.jpeg","He won't take me back when I come around Says he's sorry then he pulls me out I got a big chain around my neck And I'm broken down like a train wreck Well, it's over, I know it but I can't let go"
CASESTUDY01.jpeg,"/content/drive/MyDrive/ColabNotebooks/Images/ CASESTUDY01.jpeg",CASESTUDY01
CASESTUDY01.jpeg,"/content/drive/MyDrive/ColabNotebooks/Images/ CASESTUDY01.jpeg","Oh, how can this be? I've finally found peace Just how long 'til she's stripped from me? So come on, baby, in time we'll all freeze Ain't no stoppin' that entropy"
CASESTUDY01.jpeg,"/content/drive/MyDrive/ColabNotebooks/Images/ CASESTUDY01.jpeg","You give me your love, it's unrequited The thought of you gets me excited I guess I'll come to your crib, uninvited A few of your favorite vices, girl I know you like it"
CASESTUDY01.jpeg,"/content/drive/MyDrive/ColabNotebooks/Images/ CASESTUDY01.jpeg",I wake from my slumber I wish I could call you up Miss how you put your love on me  Boy you've got my number Wish I could feel your touch Wish you could follow up on me
CASESTUDY01.jpeg,"/content/drive/MyDrive/ColabNotebooks/Images/ CASESTUDY01.jpeg","Wanna feel it, something I can feel I know the things that I been feelin', they ain't real Look, my whole life they been beggin' me to chill Got it weighin' on my conscience just a lil'"
CASESTUDY01.jpeg,"/content/drive/MyDrive/ColabNotebooks/Images/ CASESTUDY01.jpeg","The piano that I fuck you on Same one that on which I write these songs for you They're one in the same That goes for us, too, I give you my name The bed on which I lay to sleep"
CASESTUDY01.jpeg,"/content/drive/MyDrive/ColabNotebooks/Images/ CatchaFire.jpeg","Lately you've been on a wave Seen you lit up in the place Sometimes you're sad, I see it on your face I can tell you're not okay I know you're only seeking out the beauty In fulfilling your duty The answers it seems Are inside your own dreams"
CatchaFire.jpeg,"/content/drive/MyDrive/ColabNotebooks/Images/ CatchaFire.jpeg",Catch a Fire
CatchaFire.jpeg,"/content/drive/MyDrive/ColabNotebooks/Images/ CatchaFire.jpeg","No chains around my feet but I'm not free I know I am bound here in captivity Yeah, now I've never known happiness I've never known what sweet caress is Still, I'll be always laughing like a clown"
CatchaFire.jpeg,"/content/drive/MyDrive/ColabNotebooks/Images/ CatchaFire.jpeg","Come on, let's make a move Now that the time, the time has come
Fools don't see But I know, the weak is strong So, come with me To a land of liberty Where we can live Live our lives and be free"
CatchaFire.jpeg,"/content/drive/MyDrive/ColabNotebooks/Images/ CatchaFire.jpeg","Some going east; and-a some going west Some stand aside to try their best Some living big, but the most is living small They just can't even find no food at all"
CatchaFire.jpeg,"/content/drive/MyDrive/ColabNotebooks/Images/ CatchaFire.jpeg","I think I might join the fun, But I had to hit and run See I just can't settle down In a kinky, kinky part of town Nice one; that's what they say, But I'm leaving you today Oh, darling, please don't pay: Mama say - mama say"
CatchaFire.jpeg,"/content/drive/MyDrive/ColabNotebooks/Images/ CatchaFire.jpeg","What we need is love To guide and protect us on If you hope good down from above Help the weak if you are strong now We don't need no trouble What we need is love  Oh, no!"
CatchaFire.jpeg,"/content/drive/MyDrive/ColabNotebooks/Images/ Cavalcade.jpeg","Today they say that we are free Only to be chained in poverty Good God, I think it's illiteracy It's only a machine that make money"
Cavalcade.jpeg,"/content/drive/MyDrive/ColabNotebooks/Images/ Cavalcade.jpeg",Cavalcade
Cavalcade.jpeg,"/content/drive/MyDrive/ColabNotebooks/Images/ Cavalcade.jpeg",The gargling non-song whips throng into frenzy And the echoes of his crooning now cease to be heard No-longer-pale brunettes are broken in two And thrown to the snouts of the anteater crew
Cavalcade.jpeg,"/content/drive/MyDrive/ColabNotebooks/Images/ Cavalcade.jpeg","Always crashing, screaming, relentlessly bashing Incessant, repulsive, backtracking hypotheses And we're seldom finished Oh, the beasts of the nighttime"
Cavalcade.jpeg,"/content/drive/MyDrive/ColabNotebooks/Images/ Cavalcade.jpeg","In every reflection Translucent and shimmering Those marbles appearing to make him Weightless as ever, forever weakÉ Forever ever needing a distraction to speak"
Cavalcade.jpeg,"/content/drive/MyDrive/ColabNotebooks/Images/ Cavalcade.jpeg","He tries in vain for one pure line Under the weight of tired eyes He slips into the warm, soft night To drift carefree beyond imagined eyes In dreams he finds a cure That for now will suffice"
Cavalcade.jpeg,"/content/drive/MyDrive/ColabNotebooks/Images/ Cavalcade.jpeg",Ignored as a crimson left on your toothbrush I will wait Abhorred by your kin in the name of a father I will blame Valentine Curse your ways
Cavalcade.jpeg,"/content/drive/MyDrive/ColabNotebooks/Images/ CelebrationRock.jpeg","Markus ascends forth In the heart of the common man Everyone loves, everyone loves Everyone loves, ascending fourths"
CelebrationRock.jpeg,"/content/drive/MyDrive/ColabNotebooks/Images/ CelebrationRock.jpeg",Celebration Rock
CelebrationRock.jpeg,"/content/drive/MyDrive/ColabNotebooks/Images/ CelebrationRock.jpeg",A northern soul in southern lands Will always find his way to southern hands She'll kiss away your gypsy fears And turn some restless nights to restless years
CelebrationRock.jpeg,"/content/drive/MyDrive/ColabNotebooks/Images/ CelebrationRock.jpeg",I'll run and find you in this moment And expose a passionate woman for what she is We'll cut loose our gold Cause we need fire And only kindling can buy it
CelebrationRock.jpeg,"/content/drive/MyDrive/ColabNotebooks/Images/ CelebrationRock.jpeg",Jawbone eat and jawbone talk Jawbone eat you with a knife and fork I was hunting for answers down in the dark When suddenly I had a better thought I was all dressed up Like Elvis from hell
CelebrationRock.jpeg,"/content/drive/MyDrive/ColabNotebooks/Images/ CelebrationRock.jpeg",I'll rattle the sabre of the streets Cause death got no respect for love And youth no respect for me There's no high like this Adrenaline nightshift
CelebrationRock.jpeg,"/content/drive/MyDrive/ColabNotebooks/Images/ CelebrationRock.jpeg","When they love Me and they will, Tell 'em all they'll love in your shadow And if they try to slow me down, Tell 'em all to go to hell"
CelebrationRock.jpeg,"/content/drive/MyDrive/ColabNotebooks/Images/ CeruleanSalt.jpeg","Gimme that naked new skin rush Give me younger us Gimme that you and me in a grave trust Give me younger us Gimme that girls learning love, wild and free Give me younger us"
CeruleanSalt.jpeg,"/content/drive/MyDrive/ColabNotebooks/Images/ CeruleanSalt.jpeg",Cerulean Salt
CeruleanSalt.jpeg,"/content/drive/MyDrive/ColabNotebooks/Images/ CeruleanSalt.jpeg",I watched your dad give you away I watched him drink the bitter taste in his exertion away Make-up sits on your face like tar The champagne flutes poorly engineered Employ dixie cups and jars
CeruleanSalt.jpeg,"/content/drive/MyDrive/ColabNotebooks/Images/ CeruleanSalt.jpeg",And with this drink I'll take you back home We are shimmering bright Stagger through uncharted parks The stars could be tawdry streetlights And we don't have too much to say I can't feel a thing
CeruleanSalt.jpeg,"/content/drive/MyDrive/ColabNotebooks/Images/ CeruleanSalt.jpeg","But you can't run, you can't hide You're a giant You defend all the damage you caused If I muster the strength to afflict you I won't feel any better at all"
CeruleanSalt.jpeg,"/content/drive/MyDrive/ColabNotebooks/Images/ CeruleanSalt.jpeg","And the noise on this block keeps my mind interlocked and unfastened And the struggle sheds skin, heavy breath is a deadly assassin My sister's eyes flood like rivers of wine in your absence"
CeruleanSalt.jpeg,"/content/drive/MyDrive/ColabNotebooks/Images/ CeruleanSalt.jpeg","Treacherous, empty Alert on the backseat Visiting disgrace Each dull face or first name You scan the AM for Coast to Coast IÕll try to embrace the lows"
CeruleanSalt.jpeg,"/content/drive/MyDrive/ColabNotebooks/Images/ Change.jpeg",I chose misery over dispute I've whispered and walked on eggshells Just to choose misery over dispute Choose misery over dispute
Change.jpeg,"/content/drive/MyDrive/ColabNotebooks/Images/ Change.jpeg",Change
Change.jpeg,"/content/drive/MyDrive/ColabNotebooks/Images/ Change.jpeg",Here is my new face I wear it for you Sign of a new place Honey and fruit And all of my people Think I look stranger So good to see people Being nice to other people
Change.jpeg,"/content/drive/MyDrive/ColabNotebooks/Images/ Change.jpeg",And coats keep us warm When we are cold Coats hide the pain That sits in our soul Sits in our soul
Change.jpeg,"/content/drive/MyDrive/ColabNotebooks/Images/ Change.jpeg","Sign of things coming Electricity sits on the hill So you know itÕs not the cold That makes you go Shake, shake, shake"
Change.jpeg,"/content/drive/MyDrive/ColabNotebooks/Images/ Change.jpeg","Off in the distance A man made a lake A mantis sits praying For an honest mistake Washing the windows Of the house that we built Dancing above treetops On stilts, on stilts"
Change.jpeg,"/content/drive/MyDrive/ColabNotebooks/Images/ Change.jpeg","Augustine knows Our spirit hangs low And swims like a tired minnow So slide, so slide Slide on down with me"
Change.jpeg,"/content/drive/MyDrive/ColabNotebooks/Images/ ChannelOrange.jpeg",Put paint on the ceiling Pretend itÕs the ground Where things dry smooth and even And youÕre not the only on whoÕs down And all those days Still remain And all thatÕs left Is change!
ChannelOrange.jpeg,"/content/drive/MyDrive/ColabNotebooks/Images/ ChannelOrange.jpeg",Channel Orange
ChannelOrange.jpeg,"/content/drive/MyDrive/ColabNotebooks/Images/ ChannelOrange.jpeg","A tornado flew around my room before you came Excuse the mess it made, it usually doesn't rain in Southern California, much like Arizona My eyes don't shed tears, but boy, they pour when"
ChannelOrange.jpeg,"/content/drive/MyDrive/ColabNotebooks/Images/ ChannelOrange.jpeg","You've had a landscaper and a house keeper since you were born The starshine always kept you warm So why see the world, when you got the beach? Don't know why see the world, when you got the beach The sweet life"
ChannelOrange.jpeg,"/content/drive/MyDrive/ColabNotebooks/Images/ ChannelOrange.jpeg",Too many joy rides in daddy's Jaguar Too many white lies and white lines Super rich kids with nothing but loose ends Super rich kids with nothing but fake friends
ChannelOrange.jpeg,"/content/drive/MyDrive/ColabNotebooks/Images/ ChannelOrange.jpeg",You always smokin' in the house What if my mother comes over? You can't get up and get a job 'Cause this little hustle's getting you by You're the dealer and the stoner With the sweetest kiss I've ever known
ChannelOrange.jpeg,"/content/drive/MyDrive/ColabNotebooks/Images/ ChannelOrange.jpeg","Now you're lost, lost in the heat of it all Girl, you know you're lost Lost in the thrill of it all Miami, Amsterdam, Tokyo, Spain, lost Los Angeles, India, lost on a train, lost"
ChannelOrange.jpeg,"/content/drive/MyDrive/ColabNotebooks/Images/ CheapDreams.jpeg","My fingertips and my lips They burn from the cigarettes Forrest Gump You run my mind, boy Running on my mind, boy Forrest Gump"
CheapDreams.jpeg,"/content/drive/MyDrive/ColabNotebooks/Images/ CheapDreams.jpeg",Cheap Dreams
CheapDreams.jpeg,"/content/drive/MyDrive/ColabNotebooks/Images/ CheapDreams.jpeg",Maybe its enough to be here? Take a breath and just be here Maybe its enough to be here? Take a breath and just be And just be here for once
CheapDreams.jpeg,"/content/drive/MyDrive/ColabNotebooks/Images/ CheapDreams.jpeg",Walking in the house alone Pray on the ottoman Amen for one Locked in there just because Where there is only one One is enough
CheapDreams.jpeg,"/content/drive/MyDrive/ColabNotebooks/Images/ CheapDreams.jpeg",God moves The traffic along Put me up on the Milk carton Watch me blow Across the lawn You said my life's A narrow on_
CheapDreams.jpeg,"/content/drive/MyDrive/ColabNotebooks/Images/ CheapDreams.jpeg",Driftwood fire on the shore Seen from the water Driftwood fire on the shore Leads you from the water Driftwood fire on the shore Seen from the water
CheapDreams.jpeg,"/content/drive/MyDrive/ColabNotebooks/Images/ CheapDreams.jpeg","Far past the boardwalk stares Stuck in the deep sand way out where Man, I'm gutting this out However I can We watch the surf From the bridge The bridge"
CheapDreams.jpeg,"/content/drive/MyDrive/ColabNotebooks/Images/ CheapThrills.jpeg",The sky hung low and heavy On my morning run Maybe it was just too much To ask of anyone? Of anyone Nobody loves you Just the way you want 'em to Just the way
CheapThrills.jpeg,"/content/drive/MyDrive/ColabNotebooks/Images/ CheapThrills.jpeg",Cheap Thrills
CheapThrills.jpeg,"/content/drive/MyDrive/ColabNotebooks/Images/ CheapThrills.jpeg","Everybody's got it They're all trying to feel it Everybody's dancing and singing, romancing And they want to feel more, baby Baby, I've got to feel you more Hey, feel it with me, baby, baby"
CheapThrills.jpeg,"/content/drive/MyDrive/ColabNotebooks/Images/ CheapThrills.jpeg","Whoa, I need a man to love me Oh, maybe you can help me, please Why, I need a man to love But I believe that someday and somehow it's bound to come along Because when all my dreams and all my plans just cannot turn out wrong"
CheapThrills.jpeg,"/content/drive/MyDrive/ColabNotebooks/Images/ CheapThrills.jpeg","Take another little piece of my heart now, baby Break another little bit of my heart now, darling, yeah, yeah, yeah, yeah Have another little piece of my heart now, baby Well, you know you got it, if it makes you feel good Oh, yes indeed"
