1984.jpeg,/content/drive/MyDrive/ColabNotebooks/Images/1984.jpeg,1984
Donuts.jpeg,"/content/drive/MyDrive/ColabNotebooks/Images/ Donuts.jpeg",Give peace a chance Are you afraid? Time is running out Sure it's strange Sure it's strange
Donuts.jpeg,"/content/drive/MyDrive/ColabNotebooks/Images/ Donuts.jpeg","This is Bendix, the tomorrow people What is the magic that makes one's eyes Sparkle and gleam, light up the skies The name of the game is lightworks"
Donuts.jpeg,"/content/drive/MyDrive/ColabNotebooks/Images/ Donuts.jpeg","Straight sounding like the end of the world all over again, man! Six to five of the working people I talk to wanna know Who's gonna take the responsibility, Bingle? Say it, say it! Too much, too soon!"
Donuts.jpeg,"/content/drive/MyDrive/ColabNotebooks/Images/ Donuts.jpeg",L-L-L-Ladies and gentlemen It's that time at The Regal Young man went out and made a name for himself He's been on every record-breaking show
Donuts.jpeg,"/content/drive/MyDrive/ColabNotebooks/Images/ Donuts.jpeg","Where everything is nice, and they do it twice And everybody here's waitin' for the million-dollar jackpot number to come up, man! And you know, there's a lot of sincere confusion about just what the doctor said! Too much, too soon! Yes, yes!"
Donuts.jpeg,"/content/drive/MyDrive/ColabNotebooks/Images/ Dookie.jpeg","Childhood in my life wasnÕt very pretty You see, I was born and raised in the slums of the city People moving out, people moving in The only one talking about love is the preacher"
Dookie.jpeg,"/content/drive/MyDrive/ColabNotebooks/Images/ Dookie.jpeg",Dookie
Dookie.jpeg,"/content/drive/MyDrive/ColabNotebooks/Images/ Dookie.jpeg","I'm not growin' up, I'm just burning out And I stepped in line to walk amongst the dead I'm not growin' up, I'm just burnin' out And I stepped in line to walk amongst the dead Dead"
Dookie.jpeg,"/content/drive/MyDrive/ColabNotebooks/Images/ Dookie.jpeg","Well, no one here is getting out alive This time I've really lost my mind, and I don't care So close your eyes and kiss yourself goodbye And think about the times we've spent and what they've meant"
Dookie.jpeg,"/content/drive/MyDrive/ColabNotebooks/Images/ Dookie.jpeg",Well maybe it's just jealousy Mixing up with a violent mind A circumstance that doesn't make much sense Or maybe I'm just dumb I'm a chump!
Dookie.jpeg,"/content/drive/MyDrive/ColabNotebooks/Images/ Dookie.jpeg","Pay attention to the cracked streets and the broken homes Some call it slums, some call it nice I want to take you through a wasteland I like to call my home Welcome to paradise"
Dookie.jpeg,"/content/drive/MyDrive/ColabNotebooks/Images/ Dookie.jpeg","Sometimes, I give myself the creeps Sometimes, my mind plays tricks on me It all keeps adding up I think I'm cracking up Am I just paranoid Or am I just stoned?"
Dookie.jpeg,"/content/drive/MyDrive/ColabNotebooks/Images/ Doolittle.jpeg",Are you locked up in a world that's been planned out for you? Are you feeling like a social tool without a use? Scream at me until my ears bleed I'm taking heed just for you
Doolittle.jpeg,"/content/drive/MyDrive/ColabNotebooks/Images/ Doolittle.jpeg",Doolittle
Doolittle.jpeg,"/content/drive/MyDrive/ColabNotebooks/Images/ Doolittle.jpeg","I've kissed mermaids, rode the El Ni–o Walked the sand with the crustaceans Could find my way to Mariana On a wave of mutilation Wave of mutilation"
Doolittle.jpeg,"/content/drive/MyDrive/ColabNotebooks/Images/ Doolittle.jpeg","As loud as hell, a ringing bell Behind my smile, it shakes my teeth And all the while, as vampires feed I bleed"
Doolittle.jpeg,"/content/drive/MyDrive/ColabNotebooks/Images/ Doolittle.jpeg",I know the nervous walking I know the dirty beard hangs Out by the boxcar waiting Take me away to nowhere plains There is a wait so long You'll never wait so long
Doolittle.jpeg,"/content/drive/MyDrive/ColabNotebooks/Images/ Doolittle.jpeg","Big shake on the boxcar moving Big shake to the land that's falling down Is a wind makes a palm stop blowing A big, big stone fall and break my crown"
Doolittle.jpeg,"/content/drive/MyDrive/ColabNotebooks/Images/ Doolittle.jpeg","Black tear falling on my lazy queen Got a tattooed tit say number 13 Viva, don't want no blue eyes La loma, I want brown eyes Rica, I'm in a state, I'm in a state"
Doolittle.jpeg,"/content/drive/MyDrive/ColabNotebooks/Images/ DoubleNegative.jpeg","Even there's a reason It's silver, it's gone In this land of strangers There are dangers There are sorrows Sorrows Sorrows"
DoubleNegative.jpeg,"/content/drive/MyDrive/ColabNotebooks/Images/ DoubleNegative.jpeg",Double Negative
DoubleNegative.jpeg,"/content/drive/MyDrive/ColabNotebooks/Images/ DoubleNegative.jpeg",You're telling me just one more I keep it like it's torture Keep my body like a soldier You gotta tell me when it's over But I don't know And I don't mind Take my weary bones And fly
DoubleNegative.jpeg,"/content/drive/MyDrive/ColabNotebooks/Images/ DoubleNegative.jpeg","I saw you at the grocery store, I know I should have walked over and said hello It seemed like you were in a hurry I didn't want to slow you down so I figured I should let you go"
DoubleNegative.jpeg,"/content/drive/MyDrive/ColabNotebooks/Images/ DoubleNegative.jpeg","I saw you dancing in the fire it up Before your breath and barely audible It's more a let it out than let it go It's not the end, it's just the end of hope"
DoubleNegative.jpeg,"/content/drive/MyDrive/ColabNotebooks/Images/ DoubleNegative.jpeg","All you've given, all you took All your promise, all your rules After all you've done Feed your body to the wolves It's a lie, it's the truth Only one thing you can do"
DoubleNegative.jpeg,"/content/drive/MyDrive/ColabNotebooks/Images/ DoubleNegative.jpeg",Rome in the ashes Couldn't even sigh Who will even have To wait the last in line I got magic water You can have it all Let's turn this thing up Before they take us out
DoubleNegative.jpeg,"/content/drive/MyDrive/ColabNotebooks/Images/ DoubleNickelsontheDime.jpeg",What could I say? Taken aback All that you gave Chasing the line Tear in the cut It's inside Keep in the know Throw in the earth Dancing and blood
DoubleNickelsontheDime.jpeg,"/content/drive/MyDrive/ColabNotebooks/Images/ DoubleNickelsontheDime.jpeg",Double Nickels on the Dime
DoubleNickelsontheDime.jpeg,"/content/drive/MyDrive/ColabNotebooks/Images/ DoubleNickelsontheDime.jpeg","Who'll work the fields with his hands? Who'll put his back to the plow? Who'll take the mountain and give it to the sea? Don't look now, it ain't you or me"
DoubleNickelsontheDime.jpeg,"/content/drive/MyDrive/ColabNotebooks/Images/ DoubleNickelsontheDime.jpeg","Me, naked with textbook poems Spout fountain against the Nazis With weird kinds of sex symbols In speeches that are big dance thumps If we heard mortar shells We'd cuss more in our songs And cut down on guitar solos"
DoubleNickelsontheDime.jpeg,"/content/drive/MyDrive/ColabNotebooks/Images/ DoubleNickelsontheDime.jpeg",Grinding in reversal Outdo til done Proper naked self Solutions surround In brightness be it real Blinded and free Pastel gems hit Pearlesque in flaw
DoubleNickelsontheDime.jpeg,"/content/drive/MyDrive/ColabNotebooks/Images/ DoubleNickelsontheDime.jpeg",They keep themselves hidden away They keep themselves upon the hill Afraid that they'll have to pay For all the crimes upon their head And all the men who learned to hate them
DoubleNickelsontheDime.jpeg,"/content/drive/MyDrive/ColabNotebooks/Images/ DoubleNickelsontheDime.jpeg",For my country How do others see me? I'm worried Worried but I feel guilty The media Robs and betrays us No more lies We are responsible
DoubleNickelsontheDime.jpeg,"/content/drive/MyDrive/ColabNotebooks/Images/ DragonNewWarmMountainIBelieveinYou.jpeg",I got my bills and the rent I should pitch a tent But our land isn't free So I'll work my youth away In the place of a machine I refuse to be a slave This ain't no picnic
DragonNewWarmMountainIBelieveinYou.jpeg,"/content/drive/MyDrive/ColabNotebooks/Images/ DragonNewWarmMountainIBelieveinYou.jpeg",Dragon New Warm Mountain I Believe in You
DragonNewWarmMountainIBelieveinYou.jpeg,"/content/drive/MyDrive/ColabNotebooks/Images/ DragonNewWarmMountainIBelieveinYou.jpeg",Would you stare forever at the sun And never watch the moon rising? Would you walk forever in the light To never learn the secret of the quiet night?
DragonNewWarmMountainIBelieveinYou.jpeg,"/content/drive/MyDrive/ColabNotebooks/Images/ DragonNewWarmMountainIBelieveinYou.jpeg","What's it gonna take To free the celestial body? When I say celestial I mean extraterrestrial I mean accepting the alien you've rejected in your own heart When I say heart, I mean finish"
DragonNewWarmMountainIBelieveinYou.jpeg,"/content/drive/MyDrive/ColabNotebooks/Images/ DragonNewWarmMountainIBelieveinYou.jpeg",I believe in you Even when you need to Recoil Just like that The moon goes flat Big lights in the city shine Crying out Take me to the limits of your love
DragonNewWarmMountainIBelieveinYou.jpeg,"/content/drive/MyDrive/ColabNotebooks/Images/ DragonNewWarmMountainIBelieveinYou.jpeg",The little things I like about you How you say when you say what you do When your feeling is a little gold and blue When your feeling is a little strung out Everything we talk about New York City is a crowded place I still lose sight of every other face
DragonNewWarmMountainIBelieveinYou.jpeg,"/content/drive/MyDrive/ColabNotebooks/Images/ DragonNewWarmMountainIBelieveinYou.jpeg","There is no reason to believe No reason at all Come together for_a_moment,_look around and_dissolve Like a feeling,_like a flash Like a fallen eyelash On your sweater, threading future through the past"
DragonNewWarmMountainIBelieveinYou.jpeg,"/content/drive/MyDrive/ColabNotebooks/Images/ DrawDowntheMoon.jpeg","I could never build an earthworm, never make the earth turn I've been listening to the laughing of the fox down the trail I've been clasping to the listening of the moss to the snail The shimmer of the beech leaves as the wind does a big sneeze"
DrawDowntheMoon.jpeg,"/content/drive/MyDrive/ColabNotebooks/Images/ DrawDowntheMoon.jpeg",Draw Down the Moon
DrawDowntheMoon.jpeg,"/content/drive/MyDrive/ColabNotebooks/Images/ DrawDowntheMoon.jpeg","You said we'll go down there together You and I We'll go down there together Side by side And if you should fall, I'll follow behind We'll go down there together"
DrawDowntheMoon.jpeg,"/content/drive/MyDrive/ColabNotebooks/Images/ DrawDowntheMoon.jpeg","Tell me everything I know about love Now it's thicker than my blood I thought I couldn't move my feet But I'm running with you now, we're a stampede baby I'm running with you now, we're a stampede"
DrawDowntheMoon.jpeg,"/content/drive/MyDrive/ColabNotebooks/Images/ DrawDowntheMoon.jpeg",Oh but I want to show you I I can keep it all together I want to draw down the moon For nothing but to deserve you Oh but I want to show you I
DrawDowntheMoon.jpeg,"/content/drive/MyDrive/ColabNotebooks/Images/ DrawDowntheMoon.jpeg",If I believed in love I wouldn't tell a soul I'd put my head in the sand Until I'm left alone Then wander off like a mystic And own a lonely heart
DrawDowntheMoon.jpeg,"/content/drive/MyDrive/ColabNotebooks/Images/ DrawDowntheMoon.jpeg",Oh god He's everywhere I go He's in my head like a metronome Clicking inside my brain So I can't find tempo Without a little bit of pain And maybe we could have lived without him But what would that look like he tells me
DrawDowntheMoon.jpeg,"/content/drive/MyDrive/ColabNotebooks/Images/ DrawtheLine.jpeg",Walk me to your love The reason to walk at all The reason to be homesick everywhere I go Walk me to your love The fiery core of why
DrawtheLine.jpeg,"/content/drive/MyDrive/ColabNotebooks/Images/ DrawtheLine.jpeg",Draw the Line
DrawtheLine.jpeg,"/content/drive/MyDrive/ColabNotebooks/Images/ DrawtheLine.jpeg",I wanna know why Everybody's good intentions Try to make a fool out to of me I wanna know why Everybody's good intentions Got to make a fool Got to make a fool Try to make a fool out to of me
DrawtheLine.jpeg,"/content/drive/MyDrive/ColabNotebooks/Images/ DrawtheLine.jpeg","Just then I heard a pounding on the door We're all here, sang the voice of twenty more I drink to you alas We'll take a drink and break the glass Celebrate, celebrate, celebrite it This is the critical mass"
DrawtheLine.jpeg,"/content/drive/MyDrive/ColabNotebooks/Images/ DrawtheLine.jpeg",It's the dawn of the day and I'm crashed and I'm smashed As it is I'm feeling like my chips are cashed All of my clothes strewn all over the room The crisis at hand is I'm all out of zoom
DrawtheLine.jpeg,"/content/drive/MyDrive/ColabNotebooks/Images/ DrawtheLine.jpeg",All the things you put me through What the hell you want me to Do all the things that Uncle John needs I ain't the dog that bites the hand that feeds me
DrawtheLine.jpeg,"/content/drive/MyDrive/ColabNotebooks/Images/ DrawtheLine.jpeg","Going downtown, going down, going down Neath the city, eating ground round Underground is pretty gritty I turned the screw she held the light That's when I knew she was a"
DrawtheLine.jpeg,"/content/drive/MyDrive/ColabNotebooks/Images/ Drunk.jpeg",Kings and queens and guillotines Taking lives denied Starch and parchment laid the laws When bishops took the ride Only to deceive
Drunk.jpeg,"/content/drive/MyDrive/ColabNotebooks/Images/ Drunk.jpeg",Drunk
Drunk.jpeg,"/content/drive/MyDrive/ColabNotebooks/Images/ Drunk.jpeg","I think I left my wallet at the club Yeah, yeah, yeah, yeah Ooh, ooh, ooh Jesus, take the wheel I feel weird Comb your beard, brush your teeth Still feel weird Beat your meat, go to sleep"
Drunk.jpeg,"/content/drive/MyDrive/ColabNotebooks/Images/ Drunk.jpeg","Let me show you, show you the way On the edge of dark there's the brightest light A burning light, on the edge of dark Where no one can tell they're worlds apart We'll live with dark, just take the ride"
Drunk.jpeg,"/content/drive/MyDrive/ColabNotebooks/Images/ Drunk.jpeg",You stuck me in the friend zone That's that bullshit I'm gonna play Diablo either way You can come or you could go
Drunk.jpeg,"/content/drive/MyDrive/ColabNotebooks/Images/ Drunk.jpeg","Can't open my eyes, girl 'Cause I'm just too wasted You're taking me higher Straight shots with no chaser I'm up past the clouds Can't come down, we're too faded"
Drunk.jpeg,"/content/drive/MyDrive/ColabNotebooks/Images/ Drunk.jpeg","Out of the pan and into the fire The descent into madness Bright as day, dark as night, the inferno Into the fire Black skies filled with smoke Darker horizons ahead"
Drunk.jpeg,"/content/drive/MyDrive/ColabNotebooks/Images/ DS4EVER.jpeg","Three o'clock, just can't close my eyes Something's wrong with me No, I can't deal, I can't go to sleep There's something in my heart The streets keep calling me"
DS4EVER.jpeg,"/content/drive/MyDrive/ColabNotebooks/Images/ DS4EVER.jpeg",DS4EVER
DS4EVER.jpeg,"/content/drive/MyDrive/ColabNotebooks/Images/ DS4EVER.jpeg","I'm just kickin' it with a baddie, smokin' on exotic Ain't it ironic, look at me now, I used to sell narcotics Couldn't sell it whole, had to break it down, but now it's all profit They don't like advice, but I know this life just ain't for everybody"
DS4EVER.jpeg,"/content/drive/MyDrive/ColabNotebooks/Images/ DS4EVER.jpeg","She let me squeeze, then she l_ave 'cause she keep it P Privat_ suite, private seat, bitch, I'm pushin' P Purple pint, pussy pink, bitch, I'm pushin' P"
DS4EVER.jpeg,"/content/drive/MyDrive/ColabNotebooks/Images/ DS4EVER.jpeg","I got_a bad bitch in my penthouse_right now She got on a poochie gown, ready to get piped down I stash nine hundred thou' in case I get a dark cloud No way we goin' down, money stretch a thousand miles"
DS4EVER.jpeg,"/content/drive/MyDrive/ColabNotebooks/Images/ DS4EVER.jpeg","Oops, I made a mess, G5 for the jet I'm 'bout to cash, I doubled the bet My money stretch from south to the west Lawyers the best, get home with a check He done fucked up, put some dough on his head"
DS4EVER.jpeg,"/content/drive/MyDrive/ColabNotebooks/Images/ DS4EVER.jpeg","Fast car cuttin' up in traffic, I'm one of those We ain't nothin' like these other rappers, weirdo You be tryna save her, she get active, hero Me and Gunna goin' back to back, here it go"
DS4EVER.jpeg,"/content/drive/MyDrive/ColabNotebooks/Images/ DSU.jpeg","It's Young Wunna and Young Wheezy, man, this shit too easy Different bitch for every season showin' me they cleavage I take drugs and feel relaxed, it's like they therapeutic She text that pussy, I don't call back so she won't think I need it"
DSU.jpeg,"/content/drive/MyDrive/ColabNotebooks/Images/ DSU.jpeg",DSU
DSU.jpeg,"/content/drive/MyDrive/ColabNotebooks/Images/ DSU.jpeg",Selfish but Doesn't mean a thing Bites you raw I don't wanna leave I just wanna close the door Grass is growing up my legs Breaking up the floor
DSU.jpeg,"/content/drive/MyDrive/ColabNotebooks/Images/ DSU.jpeg","Eternal return Black hair, it's swimming in my head Black hair, it's bigger than death Black hair is melting in the sun Black hair, just look at what you've done"
DSU.jpeg,"/content/drive/MyDrive/ColabNotebooks/Images/ DSU.jpeg",I look at you And feel the same Could you forgive me For that pain? Pariah kid Lost in a game Can you forgive me For that pain?
DSU.jpeg,"/content/drive/MyDrive/ColabNotebooks/Images/ DSU.jpeg",Bird got caught in a wire Don't fly Bad man can't grow a hole All right Girl pecks hole for a life Spits white Boy lives mouth off a wire Spits white
DSU.jpeg,"/content/drive/MyDrive/ColabNotebooks/Images/ DSU.jpeg",Don't take a trip Don't let me down I know I'm hollow Keep my pinwheel Spinnin' 'round Swallow this- You made a big Mistake Go away
DSU.jpeg,"/content/drive/MyDrive/ColabNotebooks/Images/ Dummy.jpeg","All I want to do is get a little bit closer to you But you, you're like glue I'm like water and you're like glue I'm like water and you're like glue And all I ever do is soak through you"
Dummy.jpeg,"/content/drive/MyDrive/ColabNotebooks/Images/ Dummy.jpeg",Dummy
Dummy.jpeg,"/content/drive/MyDrive/ColabNotebooks/Images/ Dummy.jpeg",Divine upper reaches Still holding on This ocean Will not be grasped All for nothing Did you really want Did you really want
Dummy.jpeg,"/content/drive/MyDrive/ColabNotebooks/Images/ Dummy.jpeg","To pretend no one can find The fallacies of morning rose Forbidden fruit, hidden eyes Courtesies that I despise in me Take a ride, take a shot now 'Cause nobody loves me, it's true Not like you do"
Dummy.jpeg,"/content/drive/MyDrive/ColabNotebooks/Images/ Dummy.jpeg","You don't get something for nothing, turn now Gotta try a little harder It could be sweet Like a long forgotten dream"
Dummy.jpeg,"/content/drive/MyDrive/ColabNotebooks/Images/ Dummy.jpeg","So let it be known for what we believe in I can see no reason for it to fail 'Cause this life is a farce I can't breathe through this mask Like a fool So breathe on, sister, breathe on"
Dummy.jpeg,"/content/drive/MyDrive/ColabNotebooks/Images/ Dummy.jpeg","Oh, you abandoned me, how I suffer Ridicule breathes a sigh You abandoned me, lost forever Hush, can you hear"
Dummy.jpeg,"/content/drive/MyDrive/ColabNotebooks/Images/ DustyinMemphis.jpeg","And the time that I will suffer less Is when I never have to wake Wandering stars, for whom it is reserved The blackness, the darkness, forever"
DustyinMemphis.jpeg,"/content/drive/MyDrive/ColabNotebooks/Images/ DustyinMemphis.jpeg",Dusty in Memphis
DustyinMemphis.jpeg,"/content/drive/MyDrive/ColabNotebooks/Images/ DustyinMemphis.jpeg",Just a little lovin' Early in the mornin' That little extra somethin' To kinda see them through Nothing turns the day on Really gets it dawnin' Like a little bit of lovin' From some lovin' someone like you
DustyinMemphis.jpeg,"/content/drive/MyDrive/ColabNotebooks/Images/ DustyinMemphis.jpeg","I got so much love to give you Baby, I got so much love to give you Oh, there's more than enough To last my whole life through, oh yeah It's all for you"
DustyinMemphis.jpeg,"/content/drive/MyDrive/ColabNotebooks/Images/ DustyinMemphis.jpeg",Breakfast in bed And a kiss or three You don't have to say you love me Breakfast in bed Nothing need be said
DustyinMemphis.jpeg,"/content/drive/MyDrive/ColabNotebooks/Images/ DustyinMemphis.jpeg","Just one smile means forgiving Just one kiss, the hurt's all gone Just one smile to make my life worth living A little dream to build my world upon"
DustyinMemphis.jpeg,"/content/drive/MyDrive/ColabNotebooks/Images/ DustyinMemphis.jpeg",We all like to climb to the heights of love Where our fantasy world can be found But you must know in the end When it's time to descend That there is no easy way down
DustyinMemphis.jpeg,"/content/drive/MyDrive/ColabNotebooks/Images/ Eagles.jpeg","My life is without direction Lost without you, my love The past is my shadow My shadow is you I ain't got nowhere to go What do you do when love dies? Somebody help me, I'm losing my mind"
Eagles.jpeg,"/content/drive/MyDrive/ColabNotebooks/Images/ Eagles.jpeg",Eagles
Eagles.jpeg,"/content/drive/MyDrive/ColabNotebooks/Images/ Eagles.jpeg","Take It easy, take it easy Don't let the sound of your own wheels drive you crazy Lighten up while you still can Don't even try to understand Just find a place to make your stand and take it easy"
Eagles.jpeg,"/content/drive/MyDrive/ColabNotebooks/Images/ Eagles.jpeg","Woo hoo, witchy woman See how high she flies Woo hoo, witchy woman She got the moon in her eye"
Eagles.jpeg,"/content/drive/MyDrive/ColabNotebooks/Images/ Eagles.jpeg","Cause I get a peaceful easy feelin' And I know you won't let me down 'Cause I'm already standin' I'm already standin' Yes, I'm already standin' On the ground"
Eagles.jpeg,"/content/drive/MyDrive/ColabNotebooks/Images/ Eagles.jpeg","And now the sun's coming up I'm riding with lady luck Freeway cars and trucks Stars beginning to fade, and I lead the parade Just a wishing I'd stayed a little longer Lord, don't you know the feelings getting stronger"
Eagles.jpeg,"/content/drive/MyDrive/ColabNotebooks/Images/ Eagles.jpeg","And I could've done so many things, baby If I could only stop my mind From wonderin' what I left behind And from worryin' 'bout this wasted time "
Eagles.jpeg,"/content/drive/MyDrive/ColabNotebooks/Images/ EgeBamyasi.jpeg","The clouds rolled in and hid that shore Now that Glory Train, it don't stop here no more Now I look at the years gone by and wonder at the powers that be I don't know why fortune smiles on some and lets the rest go free"
EgeBamyasi.jpeg,"/content/drive/MyDrive/ColabNotebooks/Images/ EgeBamyasi.jpeg",Ege Bamyasi
EgeBamyasi.jpeg,"/content/drive/MyDrive/ColabNotebooks/Images/ EgeBamyasi.jpeg","Her daddy got a big aeroplane Her mommy holds all the family cash A beautiful rose is standing at the corner She is living in and out of tune Hey you! YouÕre losing, youÕre losing, youÕre losing, youÕre losing your vitamin C!"
EgeBamyasi.jpeg,"/content/drive/MyDrive/ColabNotebooks/Images/ EgeBamyasi.jpeg","All string ItÕs all and now Laying down to the ground Is it the mind or is it the ground? For the bold sense, itÕs allÉ Or is it a game Or is it a game? He's just in, he just stopped I couldnÕt laugh"
EgeBamyasi.jpeg,"/content/drive/MyDrive/ColabNotebooks/Images/ EgeBamyasi.jpeg","Yes, I feel everything I'm so green, I'm so green Yes, I feel everything you say Yes, I feel as you said Trace lights, they're just going short all the time Take back any, sense to grey"
EgeBamyasi.jpeg,"/content/drive/MyDrive/ColabNotebooks/Images/ EgeBamyasi.jpeg","This is all in one's life, just break it nigh The magicÕs better all alone Just falling alone, the threshold of life LivingÕs taking all of my morning life"
EgeBamyasi.jpeg,"/content/drive/MyDrive/ColabNotebooks/Images/ EgeBamyasi.jpeg",One more suck at your head One more suck at your feet One more suck at your eyes One more suck at your shadow When mother nature get high One more Saturday night
EgeBamyasi.jpeg,"/content/drive/MyDrive/ColabNotebooks/Images/ EitherOr.jpeg","All alone, all And try this song like you found some dramatic And youÕre doing something Try your own, show them all Then you try doing without the morning thing"
EitherOr.jpeg,"/content/drive/MyDrive/ColabNotebooks/Images/ EitherOr.jpeg",Either Or
EitherOr.jpeg,"/content/drive/MyDrive/ColabNotebooks/Images/ EitherOr.jpeg",May be a long time 'til you get the call-up But it's sure as fate and hard as your luck No one'll know where you are It's just a brief smile crossing your face I'm running speed trials standing in place
EitherOr.jpeg,"/content/drive/MyDrive/ColabNotebooks/Images/ EitherOr.jpeg","Throwing candy out to the crowd Dragging down the main The helpless little thing with the dirty mouth Who's always got something to say You're sitting around at home now waiting for your brother to call I saw him down in the alley, having had enough of it all"
EitherOr.jpeg,"/content/drive/MyDrive/ColabNotebooks/Images/ EitherOr.jpeg","Drink up, baby, look at the stars I'll kiss you again, between the bars Where I'm seeing you there, with your hands in the air Waiting to finally be caught"
EitherOr.jpeg,"/content/drive/MyDrive/ColabNotebooks/Images/ EitherOr.jpeg","Cupid's trick comes down to shake and deal A stupid kick that makes me reel Sugar lie Lick me up, it's my lie Sugar, lick me up, it's my lie"
EitherOr.jpeg,"/content/drive/MyDrive/ColabNotebooks/Images/ EitherOr.jpeg",I'm going out sleepwalking Where mute memories start talking The boss that couldn't help but hurt you And the pretty thing you made desert you
